Season,Episode,Character,Line
14,14,Sharon,alright come to bed soon
11,10,Butters,hey guys
12,11,Sharon,those arent guinea pigs
13,3,Randy,uh theres about seventeen thousand dollars worth here
2,14,Mr. Garrison,what jail
6,14,Chef,intolerant of who
5,9,Stan,hey look at what the postman brought me its a big brown package from afghanistan
11,4,Cartman,yes or no kyle
2,3,Mr. Garrison,eric shut up
4,4,Sharon,yes i should have known it all makes sense now i could never get stanley to pay attention when his grandfather told him stories about the 30s
17,5,Mr. Mackey,okay lets see lights  mood  start counseling timer  okay there we go okay we got it  okay now kyle you had some concerns about your little brother
8,2,Mr. Mackey,jijimmy
11,7,Kenny,yehes
14,2,Mr. Garrison,tonight i want you to read chapters one through five and tomorrow well discuss the
7,11,Cartman,the cannibal the cannibals dead butters but he bit me  which means soon i will have a taste for human flesh as well
4,7,Sharon,ooh a tampon made from cherokee hair—now that sounds natural
5,1,Chef,uh from your ass children
10,7,Cartman,hey jimmy youre not gonna believe this but i ran away from home i just i really need the support of my best friend right now
8,4,Randy,you got served by who
13,1,Butters,its true ask anybody in fifth grade tammy warner is a total slut
13,12,Mr. Mackey,now just what the heck is going on here this is not what we have taught you in this school kyle and stan youve always been tolerant of gay people
5,12,Chef,woo fudge the snow now
1,2,Mr. Garrison,and then she finished it all by throwing her voice with two dummies at once
3,3,Chef,you bet
1,5,Kenny,mmmmmm
14,3,Randy,get your own medicinal marijuana cards youve all got perfectly good microwaves at home look im telling you guys its awesome i can have all the pot i want i get around faster than walking and wherever i need a seat i can just sit on my balls and let me tell you something else  chicks love em
3,2,Kenny,you guys take it seriously
1,3,Kenny,oh no
7,8,Mr. Garrison,room service
7,1,Kyle,and then you said
13,12,Kyle,wwell cause we want all of those fags to get out of town
10,9,Kyle,where did you hear that
4,9,Kenny,that sounds totally fuckin stupid
6,14,Mr. Garrison,eheh the first thing were gonna be learning about is communist russia
16,9,Kyle,thats not what i meant by doing something about it cartman
18,10,Stan,who did
6,14,Mr. Garrison,but this is insane
1,9,Chef,chirstmas poo  you yuhyou mean mr hankey
13,6,Randy,yeah no weve told you everything
14,3,Randy,get your own medicinal marijuana cards youve all got perfectly good microwaves at home look im telling you guys its awesome i can have all the pot i want i get around faster than walking and wherever i need a seat i can just sit on my balls and let me tell you something else  chicks love em
11,2,Cartman,hang on a second here
4,9,Randy,and just like that i left everything i dropped out of high school
5,13,Kenny,no fuckin madonna
2,2,Chef,waait  hes still breathin hes not dead
7,13,Cartman,the antismoking people they had me say i died from secondhand smoke and now they want to sacrifice me to make it look real theyll stop at nothing
10,7,Mr. Mackey,mrs cartman we have had it with your sons behavior mkay little billy turner is now being treated at the hospital
12,7,Butters,jeez uh cops are looking for us everywhere
2,4,Chef,children i heard about what happened at school today now none of you took that nasty marijuana did you
3,8,Sharon,well it is kind of a special night i guess i could experiment
1,6,Stan,we didnt know what we were doing we were just sitting there watching terrance  phillip and
1,3,Cartman,hey you would taste my pee
12,6,Sharon,all right each of you take a ticket when they call your name you can use the internet
1,1,Chef,its uh some kind of symbiotic metamorphosis device  this could mean the visitors want to communicate with us
3,17,Mr. Mackey,alright come on everybody weve got a long bus ride back to colorado mkay
2,12,Mr. Mackey,uh uuh taking over any conversations bad
7,14,Kyle,come on stan were gonna play dodgeball
4,17,Kyle,so how much done is that
3,11,Mr. Garrison,oh for petes sake what have you bastards done now
5,14,Butters,well first he went to see a movie
9,12,Stan,i am i didnt know that
2,13,Stan,im startin to think that maybe its wrong to put someone who thinks theyre a vietnamese prostitute on a bull
4,6,Mr. Garrison,eat me pervert
15,7,Sharon,who the hell is that woman randy what the hell do you think youre doing
18,2,Randy,well thats just a beer
3,10,Sharon,i dont know what the hell theyre talking about
18,5,Butters,my dad said its not for spying on people
17,5,Mr. Mackey,no this is gonna work i called intellilink and they said they were sending over an engineer
2,14,Chef,right
10,1,Chef,thats right
3,1,Mr. Mackey,uh muy bien señor presidente um ¿usted no ha visto el coro no mmhm bien oh fine fine you uh havent seen the choir have you
14,4,Stan,my profile goddamnit my facebook profile has taken on a life of its own where is it
5,13,Stan,and what are we supposed to do huh stand in that room and keep making small talk make believe like everythings okay i cant do it
4,13,Mr. Garrison,alright children as you know weve been waiting for the absent kids ballot to come in well his mother was nice enough to bring him in from the hospital so that he could cast his vote ms harris  thank you very much billy dont forget to pick up your lung  alright the absent kids ballot is for  filmore
6,16,Butters,see here he is future butters future self this is my good friend
4,4,Chef,well how do we reverse the ritalin
12,8,Butters,fing fong ting tong
15,4,Randy,"the winds of change are blowin
theres excitement in the air
can you feel it its electric and magical
the happy trains on track
cause america is back
woohoo come on"
1,13,Mr. Garrison,oh
9,9,Butters,no that darn device is nothin but trouble ah im done and im goin home to tell my mom and dad im not dead
7,11,Stan,yeah its kinda weird
6,6,Stan,butters you just dont really fit in with us here we think its best for all of us if you for friendship opportunities elsewhere
1,2,Mr. Garrison,im just so sorry that i ruined everyones chances for being on tv
15,8,Stan,enchirito
6,8,Cartman,you guys you guys  i took kyles twenty dollars down to the bank again and i got it changed into quarters
18,5,Kyle,is is this do you think this is cool
16,11,Kenny,"to wit i have found nothing wrong with this remote place and i must admit it will be with some melancholy that i will leave this island and return home
i saw this chick in a bikini on the beach too she had the nicest boobs ever
humbly yours kenneth"
2,15,Sharon,oh what a good baby what a good son i have
2,12,Sharon,oh im sorry i guess im wrong again
15,7,Sharon,what does our son turning 10 have to do with you making the same mistakes again and again
9,2,Sharon,oh my god our son is with those people
18,8,Randy,oh nothing sharon just going to the bathroom if you dont mind  hey
3,10,Mr. Garrison,aggghhh
2,11,Mr. Mackey,mkay
2,6,Stan,wait a second i dont take drugs that was a lie
5,2,Randy,stanley you call your friend an asshole this instant
4,8,Kenny,plenty this is cause my familys poor
13,9,Butters,all these bitches are kissin fellers and they havent figured out that they can be making some serious fuckin money
14,14,Randy,behind you
5,8,Sharon,go
15,11,Sharon,thats ridiculous musicals dont make me wanna give blowjobs
2,12,Sharon,oh randy i do love you but now im so confuseduh im living with roy and i dont know how to break it off with him
1,7,Chef,oh sorry  but my point is that topical cream aint gonna fix whats wrong here
6,3,Cartman,my my mom
12,3,Kenny,what no what are you doing  you fuckers
1,1,Cartman,what the hell are they talking about
16,4,Cartman,no the breads all flat no  aaaaahhhh
11,12,Butters,huwhoa
2,6,Stan,holy crap dude
8,4,Sharon,its on
14,14,Sharon,ill remember that now thanks to you
15,2,Cartman,jimmy hey jimmy  dude what the hell did you see the news
1,9,Stan,whawhat is this about christmas poo dude
2,14,Chef,but i have 24 hours to come up with your money thats the law
5,11,Kyle,now what
15,3,Mr. Mackey,what why dont worry i will be better these kids just arent listenin to me
11,12,Butters,gaa haa
3,6,Mr. Garrison,uh craig how about you
14,8,Butters,eric uh you were as poor and stupid as you could be
1,11,Chef,thats okay you know what they say about women with one arm longer than the other
6,12,Randy,well our son just said to us that he really needed to see his little friend kenny again and and that he thought it would work  if he built the ladder to heaven
7,3,Cartman,what are you talking about this is a gift from god an early easter present all wrapped up in a pretty ribbon from jesus christ himself
2,17,Cartman,i love you guys
2,14,Chef,you will
2,11,Mr. Mackey,uh oh
4,4,Chef,thats right youve made them so dull and boring that theyre actually going to go to a phil collins concert
11,9,Randy,doesnt matter hes got the record now theres nothing i can do
6,14,Mr. Garrison,im aware of that
3,5,Mr. Mackey,jakovasaurs kinda piss me off mkay
4,12,Stan,dude it looks like hes been all over time he must have such cool stuff to tell us
5,13,Butters,yeah he ah knew youd say that too so he said tsay uh up your ass jew  yeah
5,9,Kenny,oh shit were locked in
15,7,Stan,they both look like turds about to be reheated to me
18,6,Kenny,jimmy
7,5,Cartman,ms lopez wont go to sleep
18,10,Butters,well gay is wholesome
10,4,Cartman,ill certainly do my best  ow
2,10,Stan,well ive got the remote bitch hahaha
10,6,Mr. Mackey,no the last one
6,3,Butters,better prizes
10,2,Stan,come on people come on people now
6,14,Mr. Garrison,oh right right right i huh how much money exactly
14,2,Kenny,no no scrotie mcboogerballs
6,4,Sharon,stole aaare you sure
6,14,Randy,ah heres a good one  its the stereotypical sleepy mexican
12,6,Sharon,now shelly
16,12,Sharon,all right randy where are the car keys  randy where are the keys to the car  god damn it
8,2,Mr. Mackey,well timmy as your counselor i want you to know that you can tell me anything mkay and whatevers troublin you i wanna try and and help you with it
18,9,Kyle,youre watching someone play call of duty and talk about it
2,10,Randy,yeah isnt that great stanley
18,9,Kyle,youre watching someone play call of duty and talk about it
7,6,Kyle,do you kow where your doll is
3,17,Mr. Garrison,saturday last last saturday hes a paraplegic but it didnt—
14,10,Randy,aw come on thats stupid hows that hows that even possible
17,3,Mr. Mackey,mkay you sure because im here when you need me
16,2,Randy,well dad it was really great seeing you wed love to stay for dinner but the food here gives sharon diarrhea
10,4,Cartman,stop it
8,11,Butters,i know we should read the funnies  i always get good ideas from the funnies
9,8,Randy,stan
3,2,Kyle,hey that went really well they really liked it
14,5,Mr. Garrison,eric i havent used mr hat in a long time and
15,9,Butters,sing your song earn your pay
13,3,Randy,but thats impossible why would he do this
9,5,Butters,son of a biscuit
6,6,Kyle,but right now id say if were gonna have a retard for a friend i i have to pick timmy because timmy doesnt tell any jokes
18,6,Kenny,yeah
10,1,Kenny,yeah i think
14,10,Sharon,why
10,7,Mr. Mackey,we have tried at this school to make eric understand that there are boundaries mkay but frankly we believe his behavioral problems start at home
1,7,Chef,aaaaaaaaaah
1,5,Cartman,well looks like nobodys home  guess we should come back some other time
14,2,Kenny,no no scrotie mcboogerballs
2,4,Mr. Mackey,oh good point  no i dont feel any doooohh  oh baby get down mkay
2,2,Chef,doctor
13,1,Kyle,you want tammy to give you a bj
2,14,Mr. Garrison,what do you mean
3,17,Kenny,nope
16,5,Stan,well then write the principal an anonymous letter
2,15,Kenny,uh huh
2,13,Kenny,what these
7,14,Butters,go ahead and have a seat guys ah ive gotta go and find lexus
6,1,Cartman,now i think the four million should be split evenly among the three of us except that i should get a twenty percent per negation fee off the gross for having come up with the idea
7,8,Chef,aw nah dont tell me you children have taken up this whole metrosexual fad too
1,5,Mr. Garrison,ohh uh gee isnt that an amazing coincidence  hmm what are the odds of that
11,3,Kenny,not guilty
8,8,Butters,uh hey wait a minute
3,17,Mr. Mackey,well dont you want to see them
3,11,Kyle,wait i thought you called your planet marklar
2,15,Sharon,oh uhofficer barbrady woowhat what a surprise wwhat can i do for you
2,12,Stan,it doesnt matter dude it only has to last long enough to play truth or dare im gonna go get the girls
14,4,Stan,aw dad i just really dont wanna pay attention to this thing
12,12,Butters,we lost
13,1,Kenny,yep i like the food
7,6,Stan,hello maam were detectives with the south park crime unit do you have any crimes you need to be solved for a dollar
13,8,Cartman,was i alarmed  yes  i believe i was
3,17,Cartman,sweet i cant wait to see them crap their pants in front of everybody you guys
12,6,Sharon,now shelly
11,1,Randy,uh well uh
9,14,Randy,what
14,10,Stan,mr mackey you have to wake up i dont belong here i need to have my own regression therapy
15,10,Mr. Mackey,uh hi jan its counselor mackey uh how long would it take to organize a pizza friday for the students yeah yeah no they uh they actually did really well on the state exam yeah mkay
7,8,Sharon,oh hi gerald sheila
7,11,Kenny,yeah
2,12,Stan,well i dont like being around my sister anymore does that mean i can leave her too
6,16,Butters,huh naw im professor chaos stan
2,8,Stan,how many days left in summer
7,15,Kenny,gah
17,5,Kyle,excuse me but ike has homework hes supposed to be doing
2,8,Mr. Garrison,you go to hell you go to hell and you die im gonna find out who you are
16,4,Cartman,well check everywhere im not paying you guys each twenty bucks to scratch your buttholes
2,15,Sharon,stanley look whos here aunt flo
5,8,Cartman,no it isnt
1,2,Chef,how bout you and me
12,8,Butters,well its not where i aimed honest
3,10,Cartman,cool this game rules
4,7,Sharon,sheila have you tried holistic natural medicines they work wonders i read all about in people
7,14,Butters,whoa
5,12,Stan,sure dude youre our friend
9,13,Cartman,why
7,7,Stan,we just gotta figure out a way to raise three hundred thousand dollars
7,11,Kyle,sorry my minds made up
3,12,Kyle,damnit cartman thats not funny
12,8,Butters,yeah
2,3,Kenny,hi cartman
3,5,Stan,dude do we really want another one of these things hanging around
6,4,Cartman,oh mike breakin my balls mike
2,4,Mr. Mackey,mkay
2,9,Stan,well um it does sound like a pretty sweet movie
5,11,Kyle,it seems like i might get splinters though
4,13,Cartman,and now it can use wellington bear calculator too
15,10,Mr. Mackey,alright eric well well get back to class we dont want anyone seeing you in here with us
8,7,Sharon,im sure a lot of people do hon its pretty exciting isnt it now you just get some sleep  youve had a busy day  goodnight sweetie
6,4,Stan,kiss my ass
3,9,Kenny,oh no
7,6,Stan,hello maam were detectives with the south park crime unit do you have any crimes you need to be solved for a dollar
14,4,Stan,my profile goddamnit my facebook profile has taken on a life of its own where is it
1,5,Mr. Garrison,stanley what the hell has gotten in to you  you have got severe lunchroom duty mister
5,9,Kenny,no fuckin way dude
1,2,Chef,kathie lee youre my sexual fantasy
2,11,Kenny,okay got to have some huggin
17,8,Butters,no black friday is about to happen and my friends and i have to be the first ones inside the mall to get xboxes
12,8,Butters,but eric wuwhy would the chinese tell us their invasion plans
15,4,Randy,aw suck it all oya
7,8,Chef,no it isnt last year you children were all trying to be black and now youre trying to be gay
14,4,Cartman,okay lets lets try this one
2,12,Sharon,stanley your father is coming over for visitation stan  meet me in the clubhouse
13,10,Cartman,i did im the rad russian  i come from russian to crush your puny capitalist heads
1,8,Chef,gather around everybody and listen good go to your homes and arm your  what the hell are you supposed to be anyway
3,16,Chef,look stan do you really know what a period is
8,8,Sharon,stanley do you know how many people died so you could have the right to vote
10,2,Cartman,why do you want kyle back dont you see how awesome it is without him
1,1,Chef,wait where are you going alien visitors come back
10,8,Cartman,all right kenny drink your elixir of the mongoose im now going to use mocking blow
2,5,Kyle,you bastards
7,8,Mr. Garrison,chef what did you do when white people stole your culture
6,14,Mr. Garrison,im aware of that
14,10,Sharon,uh okay fine so youre gonna take my son to a dream within a dream and then what
2,5,Kenny,sheesh
9,8,Sharon,i know but im afraid its too late for them sweetie we have to try and save ourselves now
2,7,Stan,dude she always tries to quiet us down by threatening to kill that bunny but i wonder if she ever would
3,11,Mr. Garrison,i hope you give them the chair  anyway children as i was saying hare krishnas are totally gay
4,15,Mr. Mackey,now eric all these people came here and paid to send you to camp because they care about you
15,3,Stan,my sister is a den leader in girl scouts
13,1,Kenny,it means im gonna be pure and not have sex until i get married
16,10,Stan,whats this
5,10,Mr. Mackey,oh i see well well what did you used to think was funny
3,11,Kenny,to pay for the pockets on his peehole
15,14,Cartman,oh god im so nervous these kids all seem kind of mean
9,14,Randy,you heard what he said  the higher power didnt cure me im powerless again
5,7,Chef,the first thing that kids learn about sex shouldnt be some bitchscare tactic about stds
7,7,Mr. Garrison,well this is it mr slave were officially homeless
4,9,Stan,come on nobodys gonna notice
7,1,Kenny,yes it is
5,7,Butters,i dont even understand how this thing ooh wait oh i see
1,1,Chef,its uh some kind of symbiotic metamorphosis device  this could mean the visitors want to communicate with us
1,6,Chef,i dont want to touch that with a forty foot pole
8,1,Kenny,yeah thatd be awesome
2,18,Stan,no hes not gonna melt away thats frosty you stupid butthole
1,13,Mr. Garrison,no
1,10,Cartman,cartmans birthday
1,2,Chef,damn woman i just gave you sweet loving five minutes ago you trying to kill me
1,9,Mr. Mackey,to try and stay positive stay away from drug and alcohol and in the meantime im gonna put you on a heavy regimen of prozac  uuuuuuugghhoh my god you sick little monkey
6,16,Butters,wha what are you lookin for huh stan
6,13,Sharon,oh my god this is gonna be so embarrassing hi chris hi linda we were just wondering if we could get our porno back
4,13,Mr. Garrison,you yuh you what
6,1,Cartman,now i think the four million should be split evenly among the three of us except that i should get a twenty percent per negation fee off the gross for having come up with the idea
18,7,Cartman,yeah they havent worked out the audio yet but i  hes so fucking stupid  but im sure they will soon
8,2,Mr. Mackey,mmmmmkaaay i dont quite follow timmy
8,12,Butters,oh hamburgers
12,13,Mr. Garrison,all right kids in seats kids in seats  today we are going to discuss the berlin wall  this was a wall in germany that actually separated the communist east side and the democratic west side
4,12,Butters,oowuh how are we gonna do that does it hurt  i dont wanna do it if it hurts or if it makes you get all sticky
4,9,Kyle,it was
1,9,Kenny,kyles crazy
14,4,Stan,my profile goddamnit my facebook profile has taken on a life of its own where is it
3,4,Kyle,fine
10,12,Butters,who me
12,7,Kenny,no im partners with craig
4,7,Mr. Garrison,ooohhh why not
2,14,Chef,hey that has no monetary value what the hell are you taking that for
11,12,Butters,oh dad i had the craziest dream i i saved all of imaginationland from running wild after a terrorist attack
12,12,Randy,yyeeaahh yeah obama chaaange its its chaaange
12,7,Kenny,no they dont wanna see a child die you guys uf
1,3,Kyle,what
4,2,Kyle,i only got a jar of gefilte fish
1,2,Cartman,but i won the environmental essay contest
14,2,Kenny,dude what the fuck is so filthy or offensive in here
10,1,Chef,kenny how would you like to sodomize my black ass
18,2,Mr. Mackey,thats probably gluten mkay
8,9,Randy,you see boys if we like our smalltown charm more than the big corporate bullies we all have to be willing to pay a little bit more do you understand
6,16,Randy,i think hes pretty scared alright
17,10,Mr. Mackey,uh no wendy apparently you called butters girlfriend a hobbit
5,12,Stan,yeah dude your family is so rich they have their own pool table
5,14,Butters,i sure did  dad sure had a nice night out
3,17,Mr. Garrison,well mom said i could sleep in the guest room tonight good night dad
9,11,Kenny,whats a great idea
4,9,Stan,come on nobodys gonna notice
9,7,Mr. Mackey,mkay uhh jimmy why dont you come up here and write down the names of two narcotics
6,1,Butters,ow dad
2,12,Randy,uh i think i found it
7,9,Butters,uhm oh
3,9,Kenny,what the fuck is that
11,5,Kyle,jesus
2,2,Chef,i actually was with meredith baxterbirney in this very car and afterwards we used that towel to  wait a minute why am i telling you this
9,6,Cartman,we both kind of needed each other and well im gonna miss you
17,1,Butters,its time to let go eric dont you see theres no other way just let the government into your heart
5,11,Mr. Garrison,right
8,9,Stan,dad youre a geologist
14,2,Mr. Garrison,okay kids lets take our seats  there has been a change in school policy and so im assigning you all a book to read
11,5,Sharon,well hes just getting older randy maybe hes figured out the easter bunny isnt real
4,4,Chef,come on drink it down its free
16,11,Butters,no this is our home and im sick of everyone who thinks theyre better than me just cause theyve got good looks and just cause even after massacring daredevil they happen to come back and hit a home run that everyone likes you shouldnt be able to be goodlooking and be with jennifer lopez and be a good director  all right all right fine argo is a good movie there i admitted it i told people that it didnt hold up but it holds up god darn it ben affleck has everything gragh
8,1,Chef,hows it goin
15,11,Randy,no theyre theyre bros sharon stephen sondheim elton john andrew lloyd webber theyre total bros who hang out at hooters sharon im so sorry
3,8,Randy,im just having a hard time with what we did in the hot tub
16,12,Kenny,yeah stan
2,15,Chef,or haaauuunted hash browns
14,9,Randy,we could ask al qaeda
1,8,Mr. Garrison,all right boys show us what youve brought
17,2,Kenny,i knew youre up to something
5,1,Chef,i dont know children i guess weve got to get the word out to people some other way
14,2,Cartman,they fucking tricked us thats what they did tricked us into reading a book by enticing us with promises of vulgarity
7,15,Kyle,youre not gonna die kenny dont be stupid
6,4,Sharon,ms cartman this is a battle of wills we need our boys to know that were not gonna cave in at all
3,3,Stan,normally we go to chef with our problems but wuh we cant this time
17,2,Sharon,oh i love you randy
12,12,Randy,yes i can yes i can
3,8,Randy,well of course i thought it would be implied when you masturbate with another guy in a hot tub you assume that nobody is gonna tell anybody
5,6,Cartman,im not keeping it mr garrison im spending it
3,13,Mr. Garrison,alright children lets just try to pretend there isnt a little boy in a huge plastic hamster ball here and go on with our studies now who can tell me when columbus sailed the seas and discovered america  ehyes mark
6,11,Randy,if anybody takes you well be able to locate your exact location within two meters
6,2,Randy,yeah but the good news is we finally came to our senses and bought some shares in a condo so we all get to come to aspen for two weeks every year
2,8,Mr. Garrison,you go to hell you go to hell and you die im gonna find out who you are
8,10,Kenny,how about we put a real fire out
5,7,Sharon,what the hell was that
8,1,Stan,yeah huh i got you
7,5,Kenny,woohoo
10,9,Mr. Mackey,now you might all think ive given up finding out who crapped in the urinal mkay and maybe maybe you think its a victimless crime this is mr venezuela  the school janitor okay  hes the person who has to clean up when some trickster drops a dook in the wrong toilet mr venezuela makes six bucks an hour at best okay hes got three kids at home hes got a car that barely works hes gotta clean up puke with sawdust mkay then he walks into the boys room and sees a big meaty chud starin him in the face  so when you crapped in that urinal mkay you might as well have just dropped your pants and laid a turd right on top of mr venezuelas head  oh you think its funny huh
2,17,Stan,yeahyeahyeah look weve gotta know about corporate takeovers tomorrow or were screwed
6,7,Chef,oh welll hello there children
1,1,Kyle,come on ike i promise ill be nice to you from now on
9,6,Kenny,that guy would try anything
2,15,Sharon,oh stanley no not aunt flo
6,14,Butters,lemmiwinks no
7,12,Stan,no it proves he did make it all up are you blind
14,10,Sharon,why
1,1,Cartman,heh heh thats a thats thats a little joke heh heh
4,4,Mr. Garrison,this is driving me crazy i cant handle you little bastards being so mellow
1,8,Mr. Garrison,the sports watch from the commercial
15,14,Kenny,aaaahh
15,12,Cartman,polly prissypants rumpertumskin  jesus christ
5,7,Mr. Mackey,well no
3,3,Stan,but we dont like her
6,16,Butters,well they both got the same teacher for homeroom too but you didnt say anything then
9,12,Randy,hello  hey come out of there
