Season,Episode,Character,Line
3,8,Randy,well of course i thought it would be implied when you masturbate with another guy in a hot tub you assume that nobody is gonna tell anybody
2,14,Chef,huh
7,8,Mr. Garrison,one of you  weve spent our whole lives tryin not to be one of you you cant do this to us
5,7,Mr. Mackey,alright boys i now have all the information i need to teach you the female anatomy hmkay  mkay this part here is the vaginal opening  this is where the man puts his eric what the hell are you doing
1,10,Kenny,quackquack
17,2,Sharon,well get over here big guy
11,4,Kyle,god damn it cartman
6,16,Stan,butters dont you think its a little bit of a coincidence that both your future self and my future self got caught in a mexterdexed time plane
14,5,Mr. Garrison,stop there are some extremists they are threatening that if we give muhammad to the celebrities they are going to bomb us
1,12,Chef,ooh come oonn dont tell me the cure has something to do with this too
6,5,Chef,no that didnt work did i set the internal clock uh no  oh really well how do i do that
2,4,Mr. Garrison,okay children lets take our seats this morning were going to have a special lecture by your school counselor mr mackey
2,14,Mr. Garrison,dammit dont give me that medical jargon just tell me straight is he going to be okay
13,10,Cartman,i might have to wait for my hepatitis test but in the mean time i have brought my comrade from mexico to wrestle against you
4,16,Kenny,wow that is awesome
4,3,Kenny,yeah
6,5,Chef,so im supposed to press menu then function then enter
6,6,Stan,butters you just dont really fit in with us here we think its best for all of us if you for friendship opportunities elsewhere
1,2,Chef,how bout you and me
14,9,Kenny,what kind of fuckin miracle
6,2,Randy,yeah but the good news is we finally came to our senses and bought some shares in a condo so we all get to come to aspen for two weeks every year
7,4,Mr. Garrison,okay lets all take out our math homework and go over the problems
12,13,Mr. Mackey,third team foul on westchester bobcats mkay ball goes back over to the cows
7,6,Kenny,awww dont be so mean butters is our friend huh
3,9,Kenny,aww  okay you guys weve gotta get back to the camp and 
18,2,Sharon,yes
8,6,Kenny,yeah sure whatever
18,5,Butters,loo looloo loo loo loo loo loo looloo loo loo
1,7,Stan,wait where are we going
7,13,Cartman,so heh gentlemen looks like only one of us gets to be in the commercial huh who will it be gentlemen the game is on
4,15,Mr. Mackey,uh whats all this about mrs cartman is eric having trouble at havin trouble at his weightmanagement camp
6,7,Butters,well ah thats good good luck being their new friend tweek i hope youll do better than me well see ya fellas
12,7,Mr. Garrison,kids everyone together welcome to pioneer village this is a recreation of early colorado days i want you all to meet pioneer paul
2,14,Chef,hey that has no monetary value what the hell are you taking that for
10,1,Chef,im goinna im gonna
11,7,Kyle,god damn it that wasnt my idea
4,1,Butters,huhokay uhready uhset
15,10,Mr. Garrison,well okay
17,2,Mr. Mackey,butters your dad threw you down a well
15,9,Butters,meheecan
15,6,Butters,but you said to uh but i got to uh and then you told me tuh
7,7,Kenny,yeah
15,9,Butters,sing your song earn your pay
11,7,Randy,a bus a bus is coming
13,13,Mr. Mackey,beat it youre not gettin the job
7,8,Mr. Garrison,but dont you see the price youre selling out your own kind look us gays have created a lifestyle a a culture that is uniquely ours if we keep trying to make straight people into us well were gonna have no identity left
13,10,Kyle,wrestling is awesome
8,6,Kenny,nonono wait im not blanket
6,15,Chef,the victim child
2,4,Mr. Mackey,i will ms social worker i will  mkay
3,1,Mr. Mackey,oh no problem  usted es choir de estados unidos mbien
7,7,Mr. Garrison,well this is it mr slave were officially homeless
14,14,Randy,behind you
2,12,Mr. Garrison,that is enough mr hat is gone and he isnt coming back and i dont wanna hear it anyway children lets turn our history textbooks to page 105 which should be right after page 104
1,1,Chef,why bad
8,9,Sharon,here we go everyone i got three nice steaks from south park grocery well have to share them
18,5,Kenny,yeah
17,2,Sharon,ive always thought about murdering you in your sleep can you go to the cabin and get in bed
7,7,Mr. Garrison,well this is it mr slave were officially homeless
4,4,Kenny,hello chef
11,5,Kyle,so the vatican took stans dad
14,11,Sharon,oh i know and if you ask me they shouldve built a roof with enough support to land a helicopter
4,4,Kenny,very well thank you
1,4,Mr. Garrison,well just make something up like eric did
2,8,Cartman,where is chef
1,5,Randy,stanley what what in gods name have you been doing
4,4,Chef,that does it that ritalin has affected your little cracker brains too deeply im going to go see that damn pharmacist
6,5,Butters,butters aw i lose huh
17,10,Cartman,uh butters i dont know how to tell you this but lisa berger is going out with clyde
18,2,Randy,well thats just a beer
6,16,Butters,huh naw im professor chaos stan
4,8,Mr. Garrison,ogh youre such a racist bastard mr hat
2,18,Stan,no hes not gonna melt away thats frosty you stupid butthole
3,8,Mr. Mackey,be sure to help yourselves to the crab soufflé and uh eh juanita  juanita  we need some more finger sandwiches
4,15,Mr. Garrison,its called intervention eric
13,8,Kyle,aw dide this is hopeless
3,3,Chef,thats easy get some laser corrective surgery thats what i did
8,8,Kyle,youre doing the right thing stan dont you feel like youre a part of something now
14,2,Butters,i am
1,12,Cartman,well i guess well have to roshambo for it
3,14,Mr. Garrison,oh no im supposed to be at work today
3,10,Sharon,mommy misses you
9,6,Butters,hey eric
4,3,Sharon,randy
10,10,Mr. Mackey,you need to watch for bad behavior and make sure anyone in the halls during class has a hall pass mkay
4,1,Stan,theres only one thing we can do we have to go see token and see if hell forgive cartman for hatecriming him come on were running out of time
10,3,Stan,oh come on people you really think anybodys gonna be that pissed off about a cartoon
14,10,Stan,dude please wake up youre a grown man in a psychiatrists office
5,12,Stan,sure dude youre our friend
1,5,Chef,why bad
18,5,Butters,hey eric im just lookin at a video of bird eggs that i took
4,4,Mr. Garrison,timmy did you not do your homework
3,4,Kenny,hey  hey
5,7,Sharon,stanley dont you understand what you are doing
10,10,Kyle,what
2,15,Stan,dude thats not cool shes got parkinsons disease
9,14,Randy,stan you need to learn some things about being a man now give me that bottle  theres a  reason why god made our penises like little hoses boys hold the wheel stan  when you boys start driving youre gonna need to learn to do this too woahp
2,7,Kyle,hello
7,7,Randy,well like you know slurpees and stuff
2,8,Stan,how many days left in summer
17,1,Butters,yes
7,1,Stan,dude i have no idea what were seeing right now but i have a feeling its really really wrong
3,17,Mr. Garrison,come on boys youre holdin up the bus  oh wow look its kenny g himself thank you for a wonderful concert mr g
1,7,Chef,im working on it children
6,5,Cartman,woohoo
5,1,Kenny,dude weve gotta watch
9,4,Cartman,you say kenny but i say tomato
10,1,Chef,goodbye 
8,4,Butters,wuuuhaaaaaaah aaaaaaaah  no nooo noooooooooooooooo
1,3,Kyle,whoa
15,7,Sharon,what does our son turning 10 have to do with you making the same mistakes again and again
7,6,Mr. Garrison,and so you can see children that the womens movement of the late fifties and the early sixties had a profound effect on feminism in america  uh boys  would it trouble you terribly not to sleep in my class
14,9,Kyle,you just wanna lock me in there because you think im one of them
8,8,Sharon,stan you came back does that mean you learned the importance of voting
3,10,Mr. Garrison,for the last time my name is not garrisonsan all right and this is not hatsan and you all better start talking in a manner that i can understand
13,6,Randy,what
8,9,Chef,we know how to destroy it now spread the word to all the towns
6,11,Mr. Mackey,oh this is too much to take  mom dad could you please leave me alone
1,4,Mr. Garrison,who should we call on next mr hat
12,10,Sharon,oh my god
10,1,Chef,ack  ow oh ah oh dammit  ah awww
9,3,Kyle,you think you own the entertainment business but you dont give us back wing right now
3,8,Stan,mom go look outside
1,11,Chef,thats okay you know what they say about women with one arm longer than the other
8,2,Mr. Mackey,jijimmy
12,6,Randy,what
12,9,Mr. Mackey,eric get your buns back over here mkay
3,16,Sharon,what should we ask him
2,4,Mr. Garrison,okay children lets take our seats this morning were going to have a special lecture by your school counselor mr mackey
13,8,Kyle,ike ike wake up buddy wake up ike youve gotta wake up please  eh there you go thats good  oh ike i thought i lost you little brother
7,12,Randy,well look my kid was just over at your house and he a
3,3,Kenny,wait
8,3,Stan,no dude if you wanna be christian thats cool but you should follow what jesus taught instead of how he got killed focusing on how he got killed is what people did in the dark ages and it ends up with really bad results
15,3,Mr. Mackey,getting rid of tooth decay is what im tryin to fuckin do  hes your brother kyle broflovski okay how are you going to fix this
12,6,Mr. Garrison,there has to be a way to find out whats going on
14,8,Butters,eeyeah im psyched
6,11,Randy,well what are we gonna do mayor we have to stop these abductors from being able to get into our town
5,6,Cartman,whoa heheh  whoa  whoa heheheheheh  aw man that was awesohome that one part with theuum with the spider that dropped on ya oho man that totally got me that was sweet heheh
2,15,Stan,yeah but we cant get a pumpkin so we cant enter the carving contest
1,4,Mr. Garrison,do what
3,17,Kenny,nope
2,4,Mr. Mackey,at long last i have founda true reason to benow i feel i can start anew  woo whoa ow hey  uh oh helm hey
1,7,Chef,you better let me take that kyle
11,7,Kyle,what about you
7,8,Chef,sure come on in
3,16,Chef,stan let me sing you a little song about the menstrual cycle i think it might clear things up for you
6,9,Kyle,this looks like the right room
2,4,Chef,dammit children why do i always have to be the one to explain all this stuff to you  ask your parents for once
16,12,Randy,haarrrr
4,15,Chef,well no uh of course kenny is not a prostitute
5,9,Kyle,oh god it was horrible
6,11,Stan,bi ologad bag big nan dastai
6,1,Cartman,guys i think this might be a good time to discuss some business
9,8,Sharon,here you go sweetheart
2,4,Kyle,i used a bunch of bones from the butcher shop
8,9,Randy,its simple economics son i dont understand it at all but god i love it
10,8,Randy,sounds to me like we dont have a choice give me the sword  ahhhh come on weve got to get to a computer that works
8,4,Sharon,oh stan got served at school today
14,3,Sharon,randy please when you get back do you think maybe we could make love again
3,2,Randy,wow
9,9,Butters,lezzing out whats lezzing out
14,8,Kenny,what
16,10,Randy,its over but you were wrong we dont have to be afraid of amazon the only price to be paid for convenience is that we must be secure with ourselves
3,4,Cartman,well if i get ten buck from each of you thats like 2000
2,14,Chef,that does it you know what im gonna do im gonna raise that 2 million but im not going to use it to pay you back im going to use it to hire johnnie cochran myself and sue you
16,5,Kyle,look butters why dont you just talk to your family about it you said your grandmas visiting this week why dont you try talking to her
5,13,Kyle,dude he needs us right now
6,4,Sharon,oh jesus christ
9,6,Kenny,fuck yeah
5,2,Randy,well i guess were off to the bar until nine then
4,8,Chef,no damnit
4,7,Sharon,stanley what did i say about being a smartass
13,5,Kyle,i knew it dont let that fat turd walk all over you jimmy stand up for yourself
5,7,Mr. Mackey,yeah why duh did you
9,8,Randy,dont be a fag  come on we can make it  we have to try
14,10,Mr. Mackey,dont you touch that thats not something to throw away if you throw that away i will rape you in the mouth mkay i will rape you in your fuckin mouth mkay
14,3,Randy,medicinal marijuana  theres a shop that opened in the old kfc and they said i needed a doctors referral to buy weed
5,3,Butters,i am prepared  hoh jeez eh it sure got cold in here
2,10,Chef,what makes you think i would know anything about that
4,7,Sharon,stanley what did i say about being a smartass
1,10,Kenny,quackquack
7,5,Kyle,come in  come in
3,3,Chef,yeah well i learned a very important lesson this week sometimes you fall in love and you think it feels that way foreveryou change your life and didnt know your friends cause you think it cant get any betterbut then love goes away no matter what it doesnt stay as strongand then youre left with nothing cause your tinking with your dongltpgtso watch out for that love bug it can destroy like a typhoon windjust play it cool and dont be a fool
2,8,Cartman,i am not swimming around in pee
4,3,Sharon,well of course you can come in out of the snow
4,4,Chef,yes you can what the hell are you two doin prescribing all the children ritalin
4,2,Cartman,oh dude that is tits i mean that is big fat oprah tits right there
6,4,Cartman,what did i tell you stan we save some baby cows from being eaten and now were nogood dirty goddamned hippies
4,4,Mr. Garrison,that does it
9,10,Kyle,why
5,7,Mr. Garrison,yes good flora you remembered the filthy sanchez
8,3,Cartman,eup
7,11,Butters,whos coming this way
13,1,Kenny,hey tammy
11,4,Kyle,oh thats a good idea
15,5,Kyle,i do not sound like cartman goddamnit  okay so see ya
5,7,Stan,my room why
1,13,Chef,ooooh man im outta here
9,13,Kenny,what the fuck are you talking about
6,14,Mr. Garrison,eheh the first thing were gonna be learning about is communist russia
7,6,Kenny,what do we do now
2,18,Stan,what are you doing here dick were not supposed to fight until 4 oclock
5,8,Stan,alright that does it brake angrily kenny  now listen towelie weve just about had it with you
4,12,Mr. Mackey,no its really not as nice as you might imagine chef mkay
17,5,Cartman,that sucks dude
6,1,Chef,hello there children
15,14,Kenny,what the fuck are you doing here
7,13,Cartman,yeah huh  itits like the tobacco companies have control of my mind no must fight it tobacco companies making me want to smoke ah
4,7,Mr. Mackey,well thats easy write about what you know write about what you love what do you love most
12,1,Kyle,excuse me i have to step out for a minute
1,4,Mr. Garrison,excellent a
18,7,Butters,hello dad its me butters
10,13,Cartman,sciencedamnit  wait k10 can you access the stores sales records
6,7,Kyle,hey lets pour them in the teachers coffee tomorrow morning
7,1,Chef,eric the doctor has to feel inside your rectum
5,9,Stan,hey look at what the postman brought me its a big brown package from afghanistan
17,2,Sharon,ive got a surprise for you too randy
12,10,Stan,come on guys
15,10,Mr. Mackey,oh oh god oh god he killed himself eric cartman killed himself did you see that oh why would he do it  oh wait uh here heres a suicide note mkay  dear guys i just cannot go on mkay im tired of being fat mkay and i have to end it all mkay eric cartman
14,10,Sharon,so like a nightmare
3,16,Kenny,see a tampon is what you stick up your ass so you dont bleed
3,14,Randy,oh my head
6,10,Cartman,now you say it puts the lotion on its skin or else it gets the hose again
2,16,Sharon,the answer is no stanley
6,10,Cartman,yeah may be
16,10,Stan,whats this
3,1,Mr. Mackey,yes you did and until you stop flipping people off you can just go back to the waiting room mkay next  well well well if it isnt stan kyle kenny and eric
15,3,Mr. Mackey,where is tooth decay tooth decay thats your cue
16,10,Cartman,oh no really
13,1,Kenny,oh greys anatomy cool oh man this is a great dvd were gonna have the  sex yeah
14,10,Mr. Mackey,i sure did
17,5,Kyle,excuse me if my little brother has been getting some athletes hormones then who has been getting ikes medication
10,3,Kyle,we got six days to make it to los angeles if we keep our stops to a minimum we should be able to get the episode pulled just in time
2,2,Chef,the power
1,1,Stan,what how do you know she has a cat
1,1,Cartman,hi mom
3,8,Butters,uh you just got you just gotta tell us what our mission is thats all thats all bosley does just give a mission and us angels will accomplish it
8,9,Chef,my god look at all these incredible bargains
2,17,Cartman,what
14,2,Kenny,awesome
3,15,Stan,it fell
2,8,Cartman,i am not swimming around in pee
14,9,Kyle,get out of here you piece of garbage you wanna smoosh go creepin somewheres else
12,8,Butters,were busted uh what do we do
1,7,Chef,you did it children
18,5,Butters,why cant you leave it alone why cant you just stop
15,1,Kyle,i need some help i cant take it
5,13,Stan,but  i didnt get to see him hell i i didnt get to sssay goodbye  did he say anything before he went
14,3,Randy,anybody got more of that loompa loompa weed
16,5,Mr. Mackey,oh hes a little anonymous andy
2,15,Sharon,there there aunt flo stanley loves his goldfish
6,1,Butters,but fellas if i get fat my parents will ground me
5,1,Kyle,wait
5,10,Butters,i tried to make a good picture honest
17,3,Mr. Mackey,mkay you sure because im here when you need me
3,4,Kenny,you dont
16,12,Sharon,randy what is all this
4,11,Kenny,cartman cartman youve gotta help me and im not foolin around
8,8,Kyle,look it may not seem important now but your vote really does count and we all have to do our part
14,6,Cartman,my dad was a denver bronco
3,17,Mr. Mackey,mkaymr garrison youre just having a hard time dealing with the memories of your fathers sexual abuse so you switch personalities to mr hat mkay
14,10,Stan,is that why were here did something really bad happen on the field trip
2,11,Mr. Mackey,aha caught you redhanded mkay
12,10,Sharon,none of the other kids have seen them since a  randy will you put that thing down what is wrong with you our son is missing
9,12,Sharon,wwhat
7,1,Chef,we have to get eric to a proctologist right away
2,4,Mr. Mackey,i dont really have a family
11,5,Stan,stan
7,8,Chef,well what do you want me to do about it
5,7,Butters,but it wont stay on i i need a rubber band or somethin
6,1,Mr. Mackey,uh hey yeah we we woulda never laughed about this before
13,13,Mr. Mackey,we will always remember the way that gordon bravely read the announcements every morning led us in the pledge of allegiance mkay and touched many kids lives here at the school and even now that we know the shooter had him confused with a fortyyearold truck driver who happened to have a similar name i know this has been pretty traumatizing mkay but now we must decide who will pick up up where little gordon left off who will take his place reading the morning announcements its a big responsibility because it will be your voice the entire school listens to mkay and although gordon stoltski can never be replaced mkay there must be a student out there who has the drive and the passion to have his or her voice heard every morning
16,9,Stan,yeah dude its really serious
2,18,Kenny,oh no
7,7,Randy,dammit
15,7,Randy,you dont get it sharon you never have and thats supposed to be my fault
2,15,Stan,yeah but we cant get a pumpkin so we cant enter the carving contest
2,13,Kenny,what these
12,10,Cartman,no trabajar aqui vaya no pleya la musica en la promenade no es bueno
4,9,Randy,the women all left
4,17,Kenny,yeah right awesome
12,11,Randy,you cant help him
2,15,Sharon,yyes hon
1,7,Stan,for shocking people who try to give us granola treats or something
4,12,Stan,dude it looks like hes been all over time he must have such cool stuff to tell us
1,3,Randy,uhh
10,2,Stan,ah thanks i was really just trying to make it so my friend can move back here so if you dont mind im gonna try to get a hold of him now
14,2,Sharon,i mean its disgusting  its its the most disgusting thing ive ever read but the plot is amazing and the characters are so vivid
12,7,Butters,ththats it eric we have to be gettin back
2,18,Kyle,steve
3,3,Chef,no im im glad you did children now that shes gone i cant really figure out what i ever saw in her
15,13,Kenny,yeah
3,8,Mr. Garrison,thats great music mr mackey what is that
15,11,Sharon,ruhurrandy its fine you do plenty with me did you have a good time
16,12,Sharon,i spoke with the insurance company  they said we can get some of our money back not all of it but some you wanna go home get changed take a shower
2,5,Chef,dammit come on  somebody catch the ball
17,6,Mr. Mackey,anything
6,5,Butters,no i really dont have a babysitter thats why im stayin at stans
3,11,Mr. Garrison,i hope you give them the chair  anyway children as i was saying hare krishnas are totally gay
10,1,Chef,ah
4,4,Mr. Garrison,good job wendy and what was that document called
1,5,Mr. Garrison,oh mr hat isnt it beautiful
12,6,Stan,its gotta be our turn soon
1,6,Chef,hows it goin
13,14,Kyle,oh who pees in the shower
16,9,Stan,yeah dude its really serious
1,13,Chef,boy what the fudge are you doin
10,1,Mr. Mackey,so long
11,9,Randy,doesnt matter hes got the record now theres nothing i can do
8,4,Kenny,woohoo
9,14,Randy,but i put my faith in a higher power and i havent had a drink for five days now
10,13,Cartman,yeah well you can go fuck yourself
3,5,Randy,no problem jakov
2,10,Sharon,you mean stanleys missing
8,7,Sharon,im sure a lot of people do hon its pretty exciting isnt it now you just get some sleep  youve had a busy day  goodnight sweetie
1,3,Kyle,ready to go hunting cartman
12,7,Butters,no
16,1,Randy,yeah yeah
1,12,Chef,sidney poitier
2,8,Mr. Garrison,sometimes mr hat liked to pretend he was in a sauna with brett favre and a bottle of thousand island dressing
2,4,Mr. Mackey,are you boys stayin out of trouble
6,10,Sharon,randy could you have a talk with stanley
18,9,Randy,could you um pass the potatoes stan  great thanks  well nobodys talking does anyone have anything to talk about
5,4,Kyle,what
4,15,Chef,it sure is thank you
2,16,Sharon,well i hope for his sake youre right
7,14,Butters, what lexus what are you saying are you saying you dont want to be together anymore
3,17,Kenny,i dont know
13,9,Stan,hey heeey what the hell are you guys picking on butters for this time
11,5,Stan,yeah ive learned not to ask questions just dye the eggs and keep my mouth shut
3,16,Chef,look stan do you really know what a period is
12,11,Sharon,we have to see what the news is saying
10,12,Stan,dude no way
5,12,Mr. Garrison,yeah  hey rich guy  hey richie rich yeah im talkin to you richer whats in the huge box richer your checkbook
3,8,Sharon,well it is kind of a special night i guess i could experiment
6,16,Butters,wow eh eh you sure are a pprofessional eric i dont know which swatch i like best
18,8,Cartman,wow here we are mcnuggets youre reached the big time
13,7,Cartman,but guys gingers cant be pirates because they dont have souls please get it out of here
1,9,Mr. Mackey,no  get away from me
7,13,Mr. Garrison,whatd he say
6,13,Randy,there you are
16,8,Sharon,ohohh randy its happening
9,1,Kyle,ih its me kyle broflovski i had a negroplasty can i play in the allstate team now
12,10,Randy,all right here we are marsh family gathered for another dinner
8,11,Stan,hey look craig just walked in
15,9,Cartman,oh no you dont
4,7,Butters,huh where are we goin
16,5,Mr. Mackey,wull i mean it kind of wouhuh works out
9,9,Butters,you mean it
9,5,Sharon,randy sit down
5,12,Mr. Garrison,yeah hey hey you guys know why richers have such big garages cause they need a place for all their porsches and boats and aircraft carriers  yeah thats right cashchucker go have fun with your two million dollar house
2,14,Mr. Garrison,stinky britches by alanis morissette
16,7,Cartman,nooooooo
8,12,Butters,before what happens
3,17,Mr. Garrison,guess ill just go on up to bed now
10,14,Sharon,stanley where have you been its almost bedtime
2,7,Kenny,hey that freakin bike
5,5,Cartman,where the hell is phillip phillip
10,1,Chef,doctor do you have children
16,12,Kenny,yeah stan
6,7,Kyle,hey lets pour them in the teachers coffee tomorrow morning
2,7,Sharon,lets get started right away they could be halfway to l a by now
1,8,Chef,yeah yeah yeah
2,17,Mr. Garrison,uh boys you better get your asses to work
15,7,Sharon,were sorry boys but we have all decided that as of now none of you are allowed to listen to tween wave music
3,13,Stan,alright well try this again pip
7,2,Mr. Garrison,what an inspiration
3,2,Randy,uuuh mayor im a geologist
13,7,Butters,huh
2,12,Mr. Mackey,uh uuh taking over any conversations bad
1,7,Stan,oh man i cant believe hes gone
16,2,Cartman,we got crappy jewelry butters now all we need are some old people
4,14,Cartman,aw crap i mustve rigged the wrong light
12,6,Randy,what
17,2,Sharon,you lazy jerk you never do anything around the house
13,11,Stan,pirates dont worry about the law you guys said you were badasses
17,1,Butters,oh you can walk there trust me youve gotta go to the dmv its incredible see i was like you once afraid unsure and doin stuff i shouldnt do like showin people pictures of little girls with their heads on fire but you know what ive learned that just goin to the dmv and letting go of all my wrongdoings filled me with a joy ive felt nowhere else would you like to read some dmv literature  thisll tell you most of what you need to know about the dmv but just go everyone there is really nice your government is watching you and your government wants you to be happy have a nice day
